{
  "schema_id": "https://gait.dev/schemas/v1/activated-action-contract-artifact.schema.json",
  "schema_version": "1",
  "artifact_id": "gact-71eb67620196795b",
  "contract_id": "pac-0d9384785d3b213a",
  "contract_family_id": "pacf-55f758ded9e42f84",
  "revision": 1,
  "producer": {
    "name": "gait",
    "artifact_schema_version": "1",
    "contract_schema_version": "1"
  },
  "proposal": {
    "artifact_id": "paca-343c0f37a21a9530",
    "canonical_content_digest": "sha256:343c0f37a21a95301471840e6df571ef64c0ab4a8b519d1575c4bdf3bd78f6fe",
    "contract_id": "pac-0d9384785d3b213a",
    "contract_family_id": "pacf-55f758ded9e42f84",
    "revision": 1,
    "schema_id": "https://wrkr.dev/schemas/v1/proposed-action-contract-artifact.schema.json",
    "schema_version": "1",
    "contract_schema_version": "3"
  },
  "policy_digest": "sha256:0123456789abcdef0123456789abcdef0123456789abcdef0123456789abcdef",
  "activating_principal": "principal:gait-fixture",
  "authority_refs": [
    "authority:gait-fixture"
  ],
  "target": "target:fixture",
  "environment": "test",
  "activation_mode": "context_only",
  "validity": {
    "not_before": "2026-07-19T00:00:00Z",
    "not_after": "2027-07-19T00:00:00Z"
  },
  "explicit_exceptions": [],
  "report_only": false,
  "development_signing": true,
  "signature": {
    "alg": "ed25519",
    "key_id": "42571c8843a10df565fd17a97a236c3552e8e4b7ff2a0b48bf524409279771d9",
    "sig": "ltt+OCYI/1ksT0LXrc5XvhEJNH/eonNtcJ73+PhzRJfgFG2gJuAShx1WHyG0bDEv1zq00MZZ9d5bg9tmGqzTBw==",
    "signed_digest": "71eb67620196795b6eee00a22a5975fa426d99665792b555a3d96cfc40b78dee"
  }
}
