{
  "schema_id": "https://gait.dev/schemas/v1/activated-action-contract-artifact.schema.json",
  "schema_version": "1",
  "artifact_id": "gact-4aad73ff9f3c7e5a",
  "contract_id": "pac-4b7f1402784256ce",
  "contract_family_id": "pacf-55f758ded9e42f84",
  "revision": 1,
  "producer": {
    "name": "gait",
    "artifact_schema_version": "1",
    "contract_schema_version": "1"
  },
  "proposal": {
    "artifact_id": "paca-d3a371d51af5af30",
    "canonical_content_digest": "sha256:d3a371d51af5af30c4c4b8e2694b40cb16791c4e8c469bd53a483a99fb3c88cf",
    "contract_id": "pac-4b7f1402784256ce",
    "contract_family_id": "pacf-55f758ded9e42f84",
    "revision": 1,
    "schema_id": "https://wrkr.dev/schemas/v1/proposed-action-contract-artifact.schema.json",
    "schema_version": "1",
    "contract_schema_version": "3"
  },
  "policy_digest": "sha256:0123456789abcdef0123456789abcdef0123456789abcdef0123456789abcdef",
  "activating_principal": "principal:gait-fixture",
  "authority_refs": [
    "authority:gait-fixture"
  ],
  "target": "target:fixture",
  "environment": "test",
  "activation_mode": "context_only",
  "validity": {
    "not_before": "2026-07-19T00:00:00Z",
    "not_after": "2027-07-19T00:00:00Z"
  },
  "explicit_exceptions": [],
  "report_only": false,
  "development_signing": true,
  "signature": {
    "alg": "ed25519",
    "key_id": "42571c8843a10df565fd17a97a236c3552e8e4b7ff2a0b48bf524409279771d9",
    "sig": "qxqoJgKGFxq04vrCK3KbmDMgVtzKl2ofpU1lTfarZGTSe0ElLjNSieARGPl0C8SuEj53hojDADhJ1VJBLe3LDQ==",
    "signed_digest": "4aad73ff9f3c7e5a680dec3bc05684221f4770e6c47a58ed95bd7d6e1adbfe71"
  }
}
